{
  "version": "2.0.0",
  "units_note": "Lengths in inches (core converts from scene metres: in = m / 0.0254). Slopes are rise/run ratios (1:12 = 0.08333). Forces in lbf, times in seconds, distances along routes in feet where noted.",
  "evidence_kinds": {
    "measured": "Derivable from scan geometry (RoomPlan boxes, openings, mesh, occupancy grid, routes).",
    "photo": "Needs a photo the app asks for, labelled by the vision model or the user.",
    "owner": "Needs an answer from the owner/operator."
  },
  "elements": [
    {
      "id": "site",
      "description": "Whole facility / business; holds owner answers"
    },
    {
      "id": "room",
      "description": "Room from the scene model"
    },
    {
      "id": "toilet_room",
      "description": "Room with kind=restroom"
    },
    {
      "id": "wall",
      "description": "Wall"
    },
    {
      "id": "floor",
      "description": "Floor surface of a room or route"
    },
    {
      "id": "door",
      "description": "Opening with kind=door"
    },
    {
      "id": "doorway",
      "description": "Opening with kind=opening (no leaf)"
    },
    {
      "id": "window",
      "description": "Window"
    },
    {
      "id": "entrance",
      "description": "Door or doorway used as a public entrance"
    },
    {
      "id": "route",
      "description": "Accessible route leg computed by core (402, 403)"
    },
    {
      "id": "clear_floor_space",
      "description": "30x48 clear floor space core places in front of an element (305)"
    },
    {
      "id": "operable_part",
      "description": "Operable part of an element (309)"
    }
  ],
  "object_categories": [
    {
      "id": "storage",
      "origin": "roomplan",
      "roomplan_class": "storage",
      "canonical": "storage",
      "description": "Cabinets, shelving units, display fixtures RoomPlan reports as storage"
    },
    {
      "id": "refrigerator",
      "origin": "roomplan",
      "roomplan_class": "refrigerator",
      "canonical": "refrigerator",
      "description": "Refrigerator or reach-in cooler"
    },
    {
      "id": "stove",
      "origin": "roomplan",
      "roomplan_class": "stove",
      "canonical": "stove",
      "description": "Cooktop or range"
    },
    {
      "id": "bed",
      "origin": "roomplan",
      "roomplan_class": "bed",
      "canonical": "bed",
      "description": "Bed"
    },
    {
      "id": "sink",
      "origin": "roomplan",
      "roomplan_class": "sink",
      "canonical": "sink",
      "description": "Sink basin; in a toilet room core reclassifies it as lavatory"
    },
    {
      "id": "washer_dryer",
      "origin": "roomplan",
      "roomplan_class": "washerDryer",
      "canonical": "washer_dryer",
      "description": "Washer or dryer"
    },
    {
      "id": "toilet",
      "origin": "roomplan",
      "roomplan_class": "toilet",
      "canonical": "water_closet",
      "description": "RoomPlan toilet; canonical category is water_closet"
    },
    {
      "id": "bathtub",
      "origin": "roomplan",
      "roomplan_class": "bathtub",
      "canonical": "bathtub",
      "description": "Bathtub"
    },
    {
      "id": "oven",
      "origin": "roomplan",
      "roomplan_class": "oven",
      "canonical": "oven",
      "description": "Oven"
    },
    {
      "id": "dishwasher",
      "origin": "roomplan",
      "roomplan_class": "dishwasher",
      "canonical": "dishwasher",
      "description": "Dishwasher"
    },
    {
      "id": "table",
      "origin": "roomplan",
      "roomplan_class": "table",
      "canonical": "table",
      "description": "Table; core may refine to dining_table or work_surface"
    },
    {
      "id": "sofa",
      "origin": "roomplan",
      "roomplan_class": "sofa",
      "canonical": "sofa",
      "description": "Sofa or bench seating"
    },
    {
      "id": "chair",
      "origin": "roomplan",
      "roomplan_class": "chair",
      "canonical": "chair",
      "description": "Chair or stool"
    },
    {
      "id": "fireplace",
      "origin": "roomplan",
      "roomplan_class": "fireplace",
      "canonical": "fireplace",
      "description": "Fireplace"
    },
    {
      "id": "television",
      "origin": "roomplan",
      "roomplan_class": "television",
      "canonical": "television",
      "description": "Television or wall display"
    },
    {
      "id": "stairs",
      "origin": "roomplan",
      "roomplan_class": "stairs",
      "canonical": "stairs",
      "description": "Stairway"
    },
    {
      "id": "counter",
      "origin": "detector",
      "canonical": "counter",
      "description": "Generic counter or countertop"
    },
    {
      "id": "service_counter",
      "origin": "detector",
      "canonical": "service_counter",
      "description": "Counter where customers are served or order (904.4)"
    },
    {
      "id": "sales_counter",
      "origin": "detector",
      "canonical": "sales_counter",
      "description": "Sales/checkout counter with a register (904.4)"
    },
    {
      "id": "checkout_aisle",
      "origin": "detector",
      "canonical": "checkout_aisle",
      "description": "Check-out aisle with a counter (904.3)"
    },
    {
      "id": "point_of_sale_device",
      "origin": "detector",
      "canonical": "point_of_sale_device",
      "description": "Card reader / payment terminal customers operate"
    },
    {
      "id": "dining_table",
      "origin": "detector",
      "canonical": "dining_table",
      "description": "Dining surface for customers (226, 902)"
    },
    {
      "id": "bar_counter",
      "origin": "detector",
      "canonical": "bar_counter",
      "description": "Bar or high-top dining counter (226, 902)"
    },
    {
      "id": "work_surface",
      "origin": "detector",
      "canonical": "work_surface",
      "description": "Work surface used by the public (902)"
    },
    {
      "id": "food_service_line",
      "origin": "detector",
      "canonical": "food_service_line",
      "description": "Self-service food line, tray slide (904.5)"
    },
    {
      "id": "self_service_shelf",
      "origin": "detector",
      "canonical": "self_service_shelf",
      "description": "Self-service condiment/utensil/merchandise shelf (225, 811, 904.5)"
    },
    {
      "id": "shelf",
      "origin": "detector",
      "canonical": "shelf",
      "description": "Shelf or display shelf"
    },
    {
      "id": "display_rack",
      "origin": "detector",
      "canonical": "display_rack",
      "description": "Merchandise rack, gondola, display table on a route"
    },
    {
      "id": "grab_bar",
      "origin": "detector",
      "canonical": "grab_bar",
      "description": "Grab bar (609)"
    },
    {
      "id": "water_closet",
      "origin": "detector",
      "canonical": "water_closet",
      "description": "Water closet / toilet (604)"
    },
    {
      "id": "urinal",
      "origin": "detector",
      "canonical": "urinal",
      "description": "Urinal (605)"
    },
    {
      "id": "lavatory",
      "origin": "detector",
      "canonical": "lavatory",
      "description": "Lavatory / hand-wash sink (606)"
    },
    {
      "id": "toilet_compartment",
      "origin": "detector",
      "canonical": "toilet_compartment",
      "description": "Toilet compartment / stall partitions (604.8)"
    },
    {
      "id": "mirror",
      "origin": "detector",
      "canonical": "mirror",
      "description": "Mirror (603.3)"
    },
    {
      "id": "dispenser",
      "origin": "detector",
      "canonical": "dispenser",
      "description": "Soap, towel, seat-cover, sanitary product or toilet-paper dispenser (603.5, 604.7)"
    },
    {
      "id": "toilet_paper_dispenser",
      "origin": "detector",
      "canonical": "toilet_paper_dispenser",
      "description": "Toilet paper dispenser (604.7)"
    },
    {
      "id": "hand_dryer",
      "origin": "detector",
      "canonical": "hand_dryer",
      "description": "Hand dryer (603.5, 307)"
    },
    {
      "id": "baby_changing_table",
      "origin": "detector",
      "canonical": "baby_changing_table",
      "description": "Baby changing station (CBC 11B-309/603.5 accessory)"
    },
    {
      "id": "coat_hook",
      "origin": "detector",
      "canonical": "coat_hook",
      "description": "Coat hook (603.4)"
    },
    {
      "id": "sign",
      "origin": "detector",
      "canonical": "sign",
      "description": "Wall or door sign (216, 703)"
    },
    {
      "id": "door_hardware",
      "origin": "detector",
      "canonical": "door_hardware",
      "description": "Door handle, pull, lever, lock or panic bar (404.2.7)"
    },
    {
      "id": "door_closer",
      "origin": "detector",
      "canonical": "door_closer",
      "description": "Door closer or overhead stop (307.4 exception, 404.2.8)"
    },
    {
      "id": "light_switch",
      "origin": "detector",
      "canonical": "light_switch",
      "description": "Light switch or other user control (205, 309)"
    },
    {
      "id": "outlet",
      "origin": "detector",
      "canonical": "outlet",
      "description": "Electrical receptacle intended for public use (205, 309)"
    },
    {
      "id": "thermostat",
      "origin": "detector",
      "canonical": "thermostat",
      "description": "Thermostat or environmental control (205, 309)"
    },
    {
      "id": "kiosk",
      "origin": "detector",
      "canonical": "kiosk",
      "description": "Self-service kiosk / ordering screen (228, 707)"
    },
    {
      "id": "atm",
      "origin": "detector",
      "canonical": "atm",
      "description": "Automatic teller machine (228, 707)"
    },
    {
      "id": "depository",
      "origin": "detector",
      "canonical": "depository",
      "description": "Depository, drop box, mail box, vending or change machine (228)"
    },
    {
      "id": "drinking_fountain",
      "origin": "detector",
      "canonical": "drinking_fountain",
      "description": "Drinking fountain (211, 602)"
    },